{
  "instanceId": "0c185e05-99c7-4c04-aaf6-73af30eac451",
  "typeId": "6a000001-0000-4000-a000-000000000001",
  "typeVersion": 1,
  "typeNamespace": "com.semanticops.spec",
  "typeName": "rfc",
  "fieldValues": {
    "title": "RFC-013: Required Root Container & Structural Navigation",
    "rfc_number": "013",
    "author": "Peter Brownell",
    "affected_components": "`manifest.container` required; `Container.identityInstanceId`; structural navigation from membership + `precedes`.\n\n<!-- srs-integration:v1\nschema:manifest.json\nschema:container.json\nI-79\nI-80\nI-81\nI-82\n-->",
    "proposal_artifact_path": "rfcs/rfc-013-required-root-container.md",
    "content": "Makes `manifest.container` required, adds a reassignable identity pointer `Container.identityInstanceId` to both Container schemas, and defines a structural navigation model derived from existing primitives (container membership + `precedes` order). Full text: rfcs/rfc-013-required-root-container.md. Rev 7 (srs#446): [R9] tightened — a duplicate manifest.container/container-set containerId is fatal under RFC-038 [R12], no precedence; [R5] confirmed as holding without exception now that RFC-009 no longer relies on rootInstanceIds[0] position.\n\nRFC-043 Door 3 amendment (effective at dataModelRevision 8): navigation order is the order of the root container's `memberInstanceIds` entries (identity entry excluded, depth-0 entries the sections), replacing the Rule [N+12] derivation of Change C and [R5] ([R12]); [R2] resolves entry ids; identity and anchor pointers are entry ids; and [R6] reads \"is the anchor of some Container\" ([R19]). Rev 9 (Door 3, RFC-052, the-greenman/srs#941; effective at dataModelRevision 10): [R1] — the manifest names the root by `rootContainerId` and the root is stored in the container set; [R9] withdrawn; every `manifest.container` reads as the container `manifest.rootContainerId` names."
  },
  "lifecycleState": "accepted",
  "tags": [
    "topic:rfc"
  ],
  "createdAt": "2026-07-21T17:31:55.341512902+00:00",
  "updatedAt": "2026-10-20T16:46:20.063769549+00:00",
  "$schema": "https://srs.semanticops.com/schema/2.0/record.json"
}