{
  "instanceId": "e1000015-0000-4000-a000-000000000015",
  "typeId": "2a000006-0000-4000-a000-000000000006",
  "typeVersion": 1,
  "typeNamespace": "com.semanticops.spec",
  "typeName": "invariant",
  "fieldValues": {
    "invariant_number": "15",
    "title": "Every typeId referenced by any View in Package.views[] must appear in…",
    "normative_statement": "Every `typeId` referenced by any `View` in `Package.views[]` must appear in `Package.dependencyRefs` with `definitionType: \"type\"`. If `mode === \"bundled\"`, that `Type` must be present in `types[]` unless it is a definition of the RFC-029 core package, which is listed in `dependencyRefs` and need not be carried (RFC-003 [C1])."
  },
  "tags": [
    "concern:rendering",
    "concern:validation",
    "construct:package",
    "construct:reference",
    "construct:type",
    "construct:view",
    "topic:conformance"
  ],
  "createdAt": "2026-05-27T00:00:00Z",
  "updatedAt": "2026-10-03T15:35:49.475364797+00:00",
  "$schema": "https://srs.semanticops.com/schema/2.0/record.json",
  "sourceRefs": [
    {
      "note": "Invariant 15 from srs-spec.md section 08",
      "sourceRole": "evidence",
      "sourceId": "a1b2c3d4-e5f6-4a7b-8c9d-0e1f2a3b4c5d",
      "sourceType": "repository-document"
    }
  ]
}