{
  "$schema": "https://srs.semanticops.com/schema/2.0/record.json",
  "createdAt": "2026-05-27T00:00:00Z",
  "fieldValues": {
    "invariant_number": "24",
    "title": "FieldAssignment.minItems and maxItems are valid only when repeatable…",
    "normative_statement": "`FieldAssignment.minItems` and `maxItems` are valid only when `repeatable === true`. They must be ignored when `repeatable` is false or absent.",
    "applies_to": "ext:repeatable-fields"
  },
  "instanceId": "e1000024-0000-4000-a000-000000000024",
  "sourceRefs": [
    {
      "note": "Invariant 24 from srs-spec.md section 08",
      "relationType": "evidence",
      "sourceId": "a1b2c3d4-e5f6-4a7b-8c9d-0e1f2a3b4c5d",
      "sourceType": "repository-document"
    }
  ],
  "tags": [
    "concern:validation",
    "construct:field",
    "topic:conformance"
  ],
  "typeId": "2a000006-0000-4000-a000-000000000006",
  "typeName": "invariant",
  "typeNamespace": "com.semanticops.spec",
  "typeVersion": 1
}
