{
  "instanceId": "e1000028-0000-4000-a000-000000000028",
  "typeId": "2a000006-0000-4000-a000-000000000006",
  "typeVersion": 1,
  "typeNamespace": "com.semanticops.spec",
  "typeName": "invariant",
  "fieldValues": {
    "invariant_number": "28",
    "title": "Record.typeId and Record.typeVersion are the authoritative Type…",
    "normative_statement": "`Record.typeId` and `Record.typeVersion` are the authoritative Type binding. `typeNamespace` and `typeName` are denormalised convenience fields. If they conflict with the resolved `Type`, the `typeId`/`typeVersion` identity takes precedence and the Record is considered invalid until corrected."
  },
  "tags": [
    "concern:identity",
    "concern:validation",
    "construct:record",
    "construct:type",
    "topic:conformance"
  ],
  "createdAt": "2026-05-27T00:00:00Z",
  "updatedAt": "2026-09-07T19:59:35.066817187+00:00",
  "$schema": "https://srs.semanticops.com/schema/2.0/record.json",
  "sourceRefs": [
    {
      "note": "Invariant 28 from srs-spec.md section 08",
      "sourceRole": "evidence",
      "sourceId": "a1b2c3d4-e5f6-4a7b-8c9d-0e1f2a3b4c5d",
      "sourceType": "repository-document"
    }
  ]
}